{
  "swiftType": "MT202",
  "ssiType": "Primary",
  "settlementMeans": "NOS",
  "settlementAccount": "CNO MAIN",
  "beneficiaryBic": "SCBLCNSXXXX",
  "beneficiaryName": "SCB CN LTD HEAD OFFICE",
  "beneficiaryCity": "China",
  "accountWithInstitutionBic": "SUOORESSXXX",
  "accountWithInstitutionName": "SCB CN LTD HEAD OFFICE",
  "orderCustomerBic": "SCBLCNSXXXX",
  "orderCustomerName": "SCB CN LTD HEAD OFFICE",
  "orderCustomerAccount": "400899993",
  "orderCustomerCity": "China",
  "orderCustomerAddress": "22F STANDARD CHARTERED TOWER SHA"
}
